<?xml version="1.0" encoding="UTF-8"?>
<mapping xmlns:xsi="http://www.w3.org/2001/XMLSchema-instance" 
		 xmlns="http://juffrou.sourceforge.net/juffrou-xml"
         xsi:schemaLocation="http://juffrou.sourceforge.net/juffrou-xml http://juffrou.sourceforge.net/juffrou-xml/schemas/juffrou-xml.xsd">

	<serializer id="simpledate" class="net.sf.juffrou.xml.test.dom.SimpleDateSerializer"/>

	<root-element type="net.sf.juffrou.xml.test.dom.Country">
		<xml id="Country" />
		<element property="founded" xml="founded">
			<serializer ref="simpledate" />
		</element>
		<element property="name" />
		<element property="president.firstName" xml="presidentName" />
		<element property="provinces" />
		<element property="people" />
		<element property="partyLeaders" />
	</root-element>
	
	<root-element xml="Person" type="net.sf.juffrou.xml.test.dom.Person">
		<element property="firstName" />
		<element property="lastName" />
		<element property="birthDay">
			<serializer ref="simpledate" />
		</element>
	</root-element>
	
</mapping>